Title_URL,Title,Date,Ticker,Content
https://finance.yahoo.com/news/tsmc-posts-first-profit-growth-053435618.html,TSMC Cuts Chip Market Outlook as Consumer Weakness Persists,"Thu, April 18, 2024, 8:47 PM CDT","2330.TW
Watchlist
TSM
AAPL","(Bloomberg) -- Taiwan Semiconductor Manufacturing Co. scaled back its outlook for a chip market expansion, cautioning that the smartphone and personal-computing markets remain weak.Most Read from BloombergElon Wants His Money BackDubai Grinds to Standstill as Flooding Hits CityRecord Rainfall in Dubai? Blame Climate Change, Not Cloud SeedingSingapore Loses ‘World’s Best Airport’ Crown to QatarRed Lobster Considers Bankruptcy to Deal With Leases and Labor CostsThe world’s largest maker of advanced chips cut its expectations for 2024 semiconductor market growth — excluding memory chips — to about 10%, from above that figure. Chief Executive Officer C. C. Wei also trimmed his growth forecast for the foundry sector, which TSMC leads. Meanwhile, the company maintained its estimates for spending at anywhere between $28 billion and $32 billion amid capacity expansion and upgrades this year.“Macroeconomic and geopolitical uncertainty persists, potentially weighing on consumer sentiment and end-market demand,” Wei told analysts on a conference call. TSMC’s stock slid more than 6% in Taipei, the biggest intraday decline in about 18 months.The outlook overshadowed what was otherwise a solid beat on projected revenue that reaffirmed the growth TSMC and other chipmakers are seeing from demand for all things artificial intelligence. The new forecast also highlights the diverging fortunes of those who make chips for consumer products and those who are designing and manufacturing the most advanced chips for AI processing.TSMC’s forecasts may prove to be a sign of what’s to come as other chip giants prepare to post earnings. ASML Holding NV — the sole provider of the world’s most advanced chipmaking machines — reported a 22% miss on first-quarter bookings on Wednesday. Other companies including Intel Corp. report next week.Inside TSMC Chairman Liu’s Short But Impactful Reign: Tim CulpanFor a liveblog on TSMC’s earnings, click here.TSMC’s forecast follows the company’s first quarterly profit rise in a year. The main chipmaker to Nvidia Corp. and Apple Inc. expects revenue of $19.6 billion to $20.4 billion in the June quarter, beating estimates for about $19.1 billion.Story continuesThat outlook may help assuage some investors worried that AI demand won’t hold up, or that a smartphone recovery may be longer in coming. TSMC only last week disclosed its fastest sales growth since 2022, suggesting demand for the chips that accelerate artificial intelligence development is beginning to offset the fallout from a smartphone market slump. Apple, which accounted for about a quarter of TSMC’s revenue in 2023, started the year with a deep decline in iPhone sales.TSMC continues to expect revenue to grow by at least 20% this year as the broader semiconductor market recovers, despite global macroeconomic volatility.The Taiwanese chipmaker said it will begin mass production of next-generation 2nm chips in the last quarter of 2025, narrowing its timeframe from next year in general. And Wei added that TSMC’s automotive business will fall this year, versus previous projections for a rise, without elaborating.TSMC has gained about $340 billion of market value since an October 2022 trough, riding bets it will become one of the clearest winners of a global boom in AI development. On Thursday, it recorded a better-than-projected 9% rise in net income to NT$225.5 billion ($7 billion) for the March quarter.Executives said the earthquake that rocked Taiwan this month damaged some wafers used in its chip production, depressing gross margins by about 50 basis points or 0.5 percentage point in the June quarter.Read More: TSMC Says Quake Damaged Some Wafers, Leading to Small Profit HitLonger term, investors expect AI-focused chips to gradually take up a larger proportion of revenue. TSMC’s AI revenue is growing at a rate of 50% annually, the company said in January.Still, some investors have warned that the current level of AI chip demand is unsustainable over the long run. Others remain wary given the uncertainty hanging over the Taiwan Strait — the narrow body of water between China and an island it views as part of its territory.“The demand is very high, extremely high, and we’ll do our best to increase our capacity to alleviate the shortage,” Wei said of AI demand. “Probably not enough this year, but for next year we’ll try very hard.”--With assistance from Gao Yuan, Mayumi Negishi, Ville Heiskanen and Cindy Wang.(Adds share action in the third paragraph)Most Read from Bloomberg BusinessweekWhat Really Happens When You Trade In an iPhone at the Apple StoreRents Are the Fed’s ‘Biggest Stumbling Block’ in Taming US InflationAging Copper Mines Are Turning Into Money Pits Despite DemandThe Pentagon Wants to Give Defense Startups a Chance For Multinationals, Africa’s Allure Is Fading©2024 Bloomberg L.P."
https://finance.yahoo.com/news/asian-stocks-set-drop-hawkish-221827457.html,"Stocks Drop, Treasuries Climb Amid Mideast Tension: Markets Wrap","Thu, April 18, 2024, 9:04 PM CDT","^GSPC
-0.22%","(Bloomberg) — US equity futures fell in early Asian trading as risk sentiment turned, weighing on the region’s equities. Oil prices resumed a selloff and investors retreated to the dollar.Most Read from BloombergElon Wants His Money BackDubai Grinds to Standstill as Flooding Hits CityRecord Rainfall in Dubai? Blame Climate Change, Not Cloud SeedingSingapore Loses ‘World’s Best Airport’ Crown to QatarRed Lobster Considers Bankruptcy to Deal With Leases and Labor CostsThe action appeared to be linked to unverified media reports of explosions in Iran, Syria and Iraq. Oil prices rose suddenly early Friday with Brent and West Texas Intermediate climbing more than 2%.Contracts for the S&P 500 fell more than 1% Friday, placing the US benchmark on track for a sixth consecutive decline should the underlying index end Friday lower.The moves echoed a downbeat mood across markets that weakened Asian equities. Japanese stocks fell around 2%, while those in Australia and South Korea dropped more than 1%. Chinese benchmarks were mixed in opening trade.Haven assets rallied. Treasury yields fell, with the 10-year’s nearing 4.5%. An index of dollar strength also advanced despite the dip in yields, as investors sought shelter.The yen was slightly firmer against the greenback. Japanese inflation data released Friday came in below economists’ estimates. The 2.7% monthly reading for March was just short of the 2.8% consensus forecast. An increasing number of economists expect the BOJ to raise rates again in October after it stands pat next week, with most of them flagging an earlier move in July as a risk scenario, according to a Bloomberg survey.US-listed shares of Taiwan Semiconductor Manufacturing Co. dropped 4.9% after the company revised down the revenue growth outlook for the semiconductor industry, citing a softer recovery across smartphone and personal computer sectors. Infosys Ltd. slumped in the US after forecasting tepid sales growth for the year.Story continuesNew York Fed President John Williams said while it’s “not” his baseline expectation to hike interest rates, it’s possible — if warranted. His Atlanta counterpart Raphael Bostic said he doesn’t think it will be appropriate to ease until toward the end of 2024. The Fed may “potentially” hold rates steady all year, Minneapolis Fed chief Neel Kashkari told Fox News Channel.In economic data, US jobless claims remained subdued, consistent with a healthy job market. Separately, the Philadelphia Fed factory index topped estimates. While existing-home sales fell, the pace was roughly in line with the median forecast of economists.The market’s biggest worry right now is inflation, which is re-accelerating and throwing cold water on the idea of any rate cuts in 2024, according to Michael Landsberg, chief investment officer at Landsberg Bennett Private Wealth Management.“We are firmly in the camp of no rate cuts in 2024,” he said. “We believe investors should prepare for a higher-for-longer regime when it comes to both inflation and interest rates and that investment portfolios should be positioned for these dynamics for the foreseeable future.”Most emerging market currencies fell on Thursday, with the Mexican peso among the laggards as rising volatility derails carry trade positions that has propelled the currency higher for the past few months. Indonesia’s rupiah will be closely watched when trading resumes after the government asked state-owned firms to refrain from big dollar purchases in expectation the currency will weaken further.Elsewhere, gold advanced amid growing political risks and demand from central banks and Chinese consumers.Israel received its first-ever sovereign downgrade as S&P Global Ratings lowered its credit rating to A+ from AA- on heightened geopolitical risks for the region.Key events this week:BOE Deputy Governor Dave Ramsden and ECB Governing Council member Joachim Nagel speak, FridayChicago Fed President Austan Goolsbee speaks, FridaySome of the main moves in markets:StocksS&P 500 futures fell 0.8% as of 10:24 a.m. Tokyo timeNasdaq 100 futures rose 1%Japan’s Topix fell 2.1%Australia’s S&P/ASX 200 fell 1.4%Hong Kong’s Hang Seng fell 0.9%The Shanghai Composite was little changedEuro Stoxx 50 futures fell 1.3%CurrenciesThe Bloomberg Dollar Spot Index rose 0.2%The euro fell 0.1% to $1.0630The Japanese yen was little changed at 154.52 per dollarThe offshore yuan fell 0.1% to 7.2581 per dollarCryptocurrenciesBitcoin fell 2.5% to $61,927.86Ether fell 2% to $3,008.65BondsThe yield on 10-year Treasuries declined five basis points to 4.58%Japan’s 10-year yield declined 3.5 basis points to 0.830%Australia’s 10-year yield declined two basis points to 4.25%CommoditiesWest Texas Intermediate crude rose 2.2% to $84.57 a barrelSpot gold rose 0.6% to $2,392.26 an ounceThis story was produced with the assistance of Bloomberg Automation.Most Read from Bloomberg BusinessweekWhat Really Happens When You Trade In an iPhone at the Apple StoreRents Are the Fed’s ‘Biggest Stumbling Block’ in Taming US InflationAging Copper Mines Are Turning Into Money Pits Despite DemandThe Pentagon Wants to Give Defense Startups a Chance For Multinationals, Africa’s Allure Is Fading©2024 Bloomberg L.P."
https://finance.yahoo.com/news/p-downgrades-israel-rating-heightened-230746809.html,S&P Cuts Israel Rating on Heightened Geopolitical Risk,"Thu, April 18, 2024, 8:40 PM CDT",,"(Bloomberg) -- Israel was downgraded by S&P Global Ratings, which cited heightened geopolitical risks as it lowered the sovereign credit rating to A+ from AA- on Thursday.Most Read from BloombergElon Wants His Money BackDubai Grinds to Standstill as Flooding Hits CityRecord Rainfall in Dubai? Blame Climate Change, Not Cloud SeedingSingapore Loses ‘World’s Best Airport’ Crown to QatarRed Lobster Considers Bankruptcy to Deal With Leases and Labor CostsThe nation was cut by one notch to the fifth-highest score, on par with Bermuda and China. The outlook remains negative.“The recent increase in confrontation with Iran heightens already elevated geopolitical risks for Israel,” the company’s statement said.S&P said a wider regional conflict was not its baseline scenario, but could have a further material negative impact on Israel’s security situation. That would then impact its economic, fiscal, and balance-of-payments parameters.All three major rating firms have put out warnings on Israel’s credit score since the onset of the war with Hamas. On Oct. 25, S&P revised the outlook to negative on risks the conflict spreads into the country. Moody’s Ratings gave the nation its first-ever sovereign rating downgrade in February, assigning the nation the sixth-highest investment-grade score.Tensions in the region have intensified since Iran launched a barrage of drones and missiles on Israel in response to a strike in Syria that killed several Iranian officers on April 1. Tehran is bracing for a potential Israeli retaliation.Israel Versus Iran — What All-Out War Could Look Like: QuickTakeS&P forecast that Israel’s general government deficit will widen to 8% of gross domestic product in 2024, mostly as a result of increased defense spending. It expects higher deficits to persist over the medium term and net general government debt to peak at 66% of GDP in 2026.(Corrects reference to previous downgrades in first and fifth paragraphs and removes currency move in final paragraph.)Story continuesMost Read from Bloomberg BusinessweekWhat Really Happens When You Trade In an iPhone at the Apple StoreRents Are the Fed’s ‘Biggest Stumbling Block’ in Taming US InflationAging Copper Mines Are Turning Into Money Pits Despite DemandThe Pentagon Wants to Give Defense Startups a Chance For Multinationals, Africa’s Allure Is Fading©2024 Bloomberg L.P."
https://finance.yahoo.com/news/dont-buy-dip-stocks-just-005558044.html,"Don't buy the dip in stocks just yet as a wave of selling is about to bring the market to a bottom, according to one of the biggest bulls on Wall Street","Thu, April 18, 2024, 7:55 PM CDT",,"Jackyenjoyphotography/Getty ImagesInvestors shouldn't rush to buy the latest dip in the stock market, Fundstrat's Tom Lee said.That's because volatility is rising, which could bring near-term pressure to stocks.The market could be less than a month away from hitting a bottom, Lee predicted.Don't buy the dip in stocks just yet — there's a wave of selling that could see the market bottom out in the coming weeks, according to one of Wall Street's biggest bulls.Tom Lee, Fundstrat's head of research and one of the most bullish stock forecasters this year, issued a word of caution for investors looking for opportunities amid the market sell-off. Stocks have slumped after taking in a hot inflation report for March, escalating tensions in the Middle East, and hawkish guidance on Fed rate cuts, causing the S&P 500 to notch four straight days of losses.But opportunistic investors shouldn't rush into stocks just yet, Lee said, pointing to a surge in the VIX, the market's volatility gauge. Higher volatility typically triggers selling among investors, he warned, which could lead to near-term pressure for stocks.""While we normally like to buy dips, as we said earlier this week, the surge in the VIX says we gotta take buying the dip extra slowly,"" Lee said in a video sent to clients on Thursday.A buying opportunity could come soon, as the market looks poised to bottom, Lee said. That's largely because the positive catalysts for stocks are still in play, like strong corporate earnings growth. The S&P 500 is on track to report earnings growth of over 7% for the first quarter, per estimates from FactSet.The Fed also looks poised to cut interest rates sometime this year, even if rate cuts could be delayed further than investors are expecting. Markets are now pricing in one or two rate cuts by December, according to the CME FedWatch tool.Lee predicted markets could hit a trough within the next month or possibly sooner, assuming that Middle East conflict does not escalate further, volatility eases, and investors show signs that they're slowing their pace of selling.Story continues""This pullback, I think, is very good because it's providing good entry points,"" Lee said. ""All the things that are supporting stocks are still in place.""Lee predicted the S&P 500 could hit 5,200 by the end of the year, but has noted the index could notch 5,500 or higher in the best-case scenario. He was spot-on in his 2023 stock forecast, correctly calling a 20% gain in the benchmark index.Read the original article on Business Insider"
https://finance.yahoo.com/news/analysts-revamp-diamondback-energys-stock-002500102.html,Analysts revamp Diamondback Energy's stock price target ahead of earnings,"Thu, April 18, 2024, 7:25 PM CDT",FANG-0.77%WatchlistWatchlistWatchlistPatternBearishTGT+1.28%,"In 1859, Col. Edwin Drake, an American businessman, drilled the first successful oil well, at Titusville, Pa.At the time, some people called the project “Drake's Folly,” but it actually marked the birth of the modern petroleum industry.Related: Get ready for $5-a-gallon gasolineDrake sold his ""black gold"" for $20 a barrel and people have been buying the stuff ever since.Diamondback Energy  (FANG)  has been making its mark in the Permian Basin, which is located in the Southwest and has the distinction of being the highest producing oil field in the country.On Feb. 12 Diamondback said it would buy a privately held rival, Endeavor Energy Partners, in a $26 billion cash-and-stock deal that would “create a premier Permian independent operator.”“This is a combination of two strong, established companies merging to create a ‘must own’ North American independent oil company,” Travis Stice, Diamondback’s chairman and CEO, said in a statement. ""With this combination, Diamondback not only gets bigger, it gets better.”During a Feb. 21 call with analysts, Stice said that in his experience, ""as companies get bigger, the more inwardly focused they become.""So, they focus more on their own results and less on what others are doing around them,"" he said. ""But it's been a hallmark of ours to really pay attention to what goes on around us.""<img alt=""<em>Analysts adjust their price targets for Diamondback Energy, a major Permian basin crude oil producer.</em><p>Shutterstock</p>"" src=""https://s.yimg.com/ny/api/res/1.2/TS7DZuFhoWZP1E69CjqUYA--/YXBwaWQ9aGlnaGxhbmRlcjt3PTcwNTtoPTM5Nw--/https://media.zenfs.com/en/thestreet_881/d5a59163c76437f1fbf691b559184a71"" class=""caas-img"">Analysts adjust their price targets for Diamondback Energy, a major Permian basin crude oil producer.ShutterstockDiamondback CEO: 'Our culture will stay intact'Stice said, ""It's culturally ingrained not only to rigorously examine our own internal results but also spend intellectual capital on looking across the barbed wire fence at what others are doing.""""And as we move into a much larger position post-close, I promise you, that culture will stay intact,"" he said.Fewer wells would be needed to keep production flat in 2025 and beyond, with both companies being able to run a full business on Diamondback's cost structure, President and Chief Financial Officer Kaes Van't Hof said.Story continuesThe combined company would be the third-largest oil and gas producer in the Permian Basin of West Texas and New Mexico, behind Exxon Mobil  (XOM)  and Chevron  (CVX) , both of which announced their own acquisition deals in October.The new entity would also be the only pure-play Permian oil producer outside of Pioneer Natural Resources  (PXD) , which is being acquired by Exxon Mobil. Meanwhile, Chevron said it was buying Hess  (HES)  for $53 billion.Diamondback Energy is scheduled to report first-quarter results on April 30 after the market closes.Analysts surveyed by FactSet expect the company to report profit of $4.38 a share on $2.09 billion of revenue. A year earlier Diamondback earned $4.10 a share on $1.92 billion in revenue.In February, the company posted a fourth-quarter profit of $4.74 a share on $2.23 billion in revenue, beating Wall Street's call for $4.70 and $2.16 billion.Analyst focuses on acquisitionAnalysts recently have been reacting to Diamondback's plans.Last week, Mizuho analyst Nitin Kumar raised his price target on Diamondback to $217 from $200 and affirmed a buy rating on the stock.The price-target hike came amid expectations that Diamondback could finalize its acquisition of Endeavor Energy Resources sooner than initially anticipated.Kumar noted that Diamondback Energy has risen about 35% this year. (The stock closed on April 17 at $201.15.)More Economic Analysis:Watch out for 8% mortgage ratesHot inflation report batters stocks; here's what happens nextInflation report will disappoint markets (and the Fed)An April 8 regulatory filing by Diamondback outlined a possible timeline for the completion of the Endeavor transaction, he said. A shareholder vote is scheduled for April 26, Kumar said. According to Mizuho's analysis, the deal might close in the second quarter, but its base case is closing sometime this year.ScotiaBank analyst Paul Cheng also raised his price target on Diamondback shares last week, boosting it to $255 from $210 while reiterating a buy rating on the stock.The update came after the firm published a commodity price deck, where it raised its near- and long-term oil-price forecasts.On April 17, Wells Fargo analyst Roger Read raised the firm's price target on Diamondback Energy to $227 from $203 and held to an overweight rating on the shares.Based on robust operational momentum, the firm sees potential upside to 2024 U.S. onshore oil production estimates, translating to another year of higher-than-expected U.S. supply growth.Continued drilling and completion efficiency improvements, incremental cost deflation, and a focus on high grading should combine to create positive momentum throughout 2024, Read added.Related: Veteran fund manager picks favorite stocks for 2024"
