Title_URL,Title,Date,Ticker,Content
https://finance.yahoo.com/news/asian-shares-pressured-chipmakers-focus-221436462.html,Treasuries Hit as Hawkish Fed Views Keep Piling Up: Markets Wrap,"Thu, April 18, 2024, 4:06 PM CDT","BAC
Watchlist
^GSPC","(Bloomberg) -- The world’s biggest bond market extended this month’s selloff after solid economic readings and hawkish Fedspeak reinforced speculation that interest rates will remain higher for longer.Most Read from BloombergElon Wants His Money BackDubai Grinds to Standstill as Flooding Hits CityRecord Rainfall in Dubai? Blame Climate Change, Not Cloud SeedingSingapore Loses ‘World’s Best Airport’ Crown to QatarRed Lobster Considers Bankruptcy to Deal With Leases and Labor CostsTreasuries fell across the US curve — with two-year yields once again near the 5% mark. The S&P 500 dropped for a fifth straight session — its longest losing run since October. The dollar rose. An initial quarter-point Federal Reserve rate cut remained priced in for November.When asked about the possibility of hiking, Fed Bank of New York President John Williams said that while it is “not” his baseline expectation, it’s possible — if warranted. His Atlanta counterpart Raphael Bostic noted he doesn’t think it will be appropriate to ease until toward the end of 2024. The Fed could “potentially” hold rates steady all year, Minneapolis Fed chief Neel Kashkari told Fox News Channel.Market-implied expectations for Fed rate cuts waned further this week after Chair Jerome Powell signaled policymakers will wait longer than previously anticipated to ease policy. Traders now see just one to two rate cuts this year. That’s a far cry from the roughly six they expected at the start of 2024, and the three that Fed officials penciled in just a month ago.“The Fed rhetoric was skewed hawkishly,” said Ian Lyngen and Vail Hartman at BMO Capital Markets. “The data lineup and updates from an array of talking Feds left the market with the impression that Powell’s assessment on Tuesday is the party line — therefore ‘wait and see’ to ‘wait and see’.”Treasury 10-year yields rose five basis points to 4.63%. The S&P 500 fell to around 5,010, with its most influential group — technology — leading declines. Netflix Inc. posted its best start to the year since 2020, attracting more new customers than anyone expected thanks to a strong slate of original programs and a crackdown on password sharing.Story continuesRead: TIPS Auction Stops Through at Decade’s Second-Highest Yield“Fedspeak is making us increasingly nervous,” said Andrew Brenner at NatAlliance Securities. He added that if the two-year US yield breaks 5%, the next level to watch would be 5.2%.In economic data, jobless claims remained subdued, consistent with a healthy job market. Separately, the Philadelphia Fed factory index topped estimates. While existing-home sales fell, the pace was roughly in line with the median forecast of economists.“Most of the data this week show the economy is still firing on all cylinders,” said Chris Larkin at E*Trade from Morgan Stanley. “That’s going to be a challenge for the Fed’s rate-cutting plans.”Read: Less Dovish Fed Comes Into Line With MarketThe Fed may not cut interest rates at all this year with inflation remaining high, said JPMorgan Chase & Co. President Daniel Pinto.“It may take a bit longer until they can cut rates,” Pinto said at a Semafor event in Washington, adding that the likelihood of a rate hike is “very, very low” amid widespread skepticism that inflation will ease any time soon. The Fed isn’t in any hurry, as a rate cut that comes too early would be “painful” and probably cause a recession, he said.The market’s biggest worry right now is inflation, which is re-accelerating and throwing cold water on the idea of any rate cuts in 2024, let alone one or two, according to Michael Landsberg, chief investment officer at Landsberg Bennett Private Wealth Management.“We are firmly in the camp of no rate cuts in 2024,” he said. “We believe investors should prepare for a higher for longer regime when it comes to both inflation and interest rates and that investment portfolios should be positioned for these dynamics for the foreseeable future.”“With rate cuts delayed, rather than canceled, in our view, we still expect the yield on the 10-year US Treasury to end the year around 3.85%, said Mark Haefele at UBS Global Wealth Management. “Once the Fed begins cutting rates this year, the bond market will likely continue to price a sequence of further cuts into 2025 and beyond.”While timing the market is hard, investors can more confidently add duration exposure, according to Bank of America Corp. strategists led by Mark Cabana, who recommend “going long” five-year Treasuries.The trade is supported by “Fed unlikely to hike, risk asset sensitivity to rates and cleaner duration positioning,” they noted.Corporate Highlights:Alphabet Inc. Chief Executive Officer Sundar Pichai announced changes to Google’s workplace teams structure, saying the moves will help the company develop artificial intelligence products and services faster and more efficiently.Micron Technology Inc., the largest US maker of computer-memory chips, is poised to get $6.1 billion in grants from the Commerce Department to help pay for domestic factory projects, part of an effort to bring semiconductor production back to American soil.D.R. Horton Inc. increased sales expectations for its full fiscal year as the US housing market heads into its key spring selling season.Alaska Air Group Inc. expects second-quarter profits will top analyst estimates, signaling that the carrier is recovering from a near-catastrophe on one of its planes that triggered the temporary grounding of a key Boeing Co. aircraft model.Las Vegas Sands Corp. said remodeling at an entertainment center and a hotel in Macau will crimp results this year.EBay Inc.’s embrace of artificial intelligence has turned the stock’s most bearish analyst into its biggest fan, with Morgan Stanley seeing a further 25% gain for the shares over the next year.DNA testing firm 23andMe Holding Co.’s Chief Executive Officer Anne Wojcicki said she’s considering taking the struggling company private, less than three years after it began selling shares.Blackstone Inc. collected more fees from big retail funds and credit strategies during the first quarter, compensating for the slower pace of deal exits.L’Oréal SA reported better-than-expected first-quarter sales as strength in Europe and North America helped offset a slowdown in shopping by Chinese travelers.Key events this week:Japan CPI, FridayBOE Deputy Governor Dave Ramsden and ECB Governing Council member Joachim Nagel speak, FridayChicago Fed President Austan Goolsbee speaks, FridaySome of the main moves in markets:StocksThe S&P 500 fell 0.2% as of 4 p.m. New York timeThe Nasdaq 100 fell 0.6%The Dow Jones Industrial Average was little changedThe MSCI World index was little changedCurrenciesThe Bloomberg Dollar Spot Index rose 0.1%The euro fell 0.3% to $1.0644The British pound fell 0.1% to $1.2437The Japanese yen fell 0.1% to 154.62 per dollarCryptocurrenciesBitcoin rose 4.4% to $63,518.01Ether rose 3.1% to $3,065.7BondsThe yield on 10-year Treasuries advanced five basis points to 4.63%Germany’s 10-year yield advanced three basis points to 2.50%Britain’s 10-year yield advanced one basis point to 4.27%CommoditiesWest Texas Intermediate crude was little changedSpot gold rose 0.8% to $2,380.08 an ounceThis story was produced with the assistance of Bloomberg Automation.Most Read from Bloomberg BusinessweekWhat Really Happens When You Trade In an iPhone at the Apple StoreRents Are the Fed’s ‘Biggest Stumbling Block’ in Taming US InflationAging Copper Mines Are Turning Into Money Pits Despite DemandThe Pentagon Wants to Give Defense Startups a Chance For Multinationals, Africa’s Allure Is Fading©2024 Bloomberg L.P."
https://finance.yahoo.com/news/national-average-money-market-account-171030238.html,National average money market account rates for April 2024,"Thu, April 18, 2024, 4:06 PM CDT",,"A money market account is a type of savings deposit account that tends to offer check-writing privileges and a debit card for ATM access to your savings. Typically, savings accounts usually don’t let you write checks from the account, making money market accounts a unique option to store and tap your money when you need it.This article provides the most up-to-date average money market account annual percentage yield, which is 0.46 percent, and insight as to why knowing the average money market account rate is important. It’s easy to earn a much higher return than the average money market account rate by shopping around.The Federal Reserve directly impacts money market account rates at competitive banks. Generally, you’ll find that Federal Deposit Insurance Corp. (FDIC) bank rate increases follow the Fed’s movements. But a Fed rate increase isn’t a guarantee that a bank will raise rates.That’s why you have to compare rates to find the right account for your financial needs.And beyond yields, you’ll want to make sure a money market account has the features that you’re looking for. Check-writing privileges, ATM access, mobile check deposit and a highly-rated app are the features people tend to look for.Except for the potential for check writing, a money market account and a high yield savings account are nearly similar. So it’s also worth considering opening a high interest savings account in your search for a money market account.You might be rewarded for depositing more money in a money market accountSome money market accounts give you a higher APY for carrying a larger balance. These accounts, called jumbo money market accounts, are worth looking into if you’re looking to deposit a large sum into a liquid account. Always make sure you’re following the FDIC’s rules and guidelines to make sure that your money is protected in the event of a bank failure.Latest average money market account APYs for the past 3 monthsDateMoney market account national average APY4/15/20240.46%4/8/20240.47%4/1/20240.47%3/25/20240.48%3/18/20240.48%3/11/20240.48%3/4/20240.47%2/26/20240.47%2/19/20240.46%2/12/20240.47%2/5/20240.47%1/29/20240.47%1/22/20240.46%1/15/20240.48%1/8/20240.46%1/1/20230.47%12/25/20230.47%12/18/20230.46%12/11/20230.46%How we calculate the national average interest ratesIn June 2023, Bankrate updated its methodology that determines the national average CD rates. More than 500 banks and credit unions are surveyed weekly to generate the national averages. Among these institutions are those that are broadly available and offer high yields, as well as some of the nation’s largest banks.Story continuesCompare current money market account rates for April 2024Vio Bank — 5.30% APYUFB Direct — 5.25% APYCFG Community Bank — 5.25% APYQuontic Bank — 5.00% APYSallie Mae Bank — 4.65% APYSee additional best money market account rates.Note: Annual percentage yields (APYs) shown were updated between April 18-25. Bankrate’s editorial team validates this information regularly, typically biweekly. APYs may have changed since they were last updated and may vary by region for some products. Bankrate includes only FDIC banks or National Credit Union Administration (NCUA) credit unions in its listings.Bottom lineYou can easily earn more than the national average rate in a money market account. Some FDIC-insured online banks have money market accounts that either don’t require a minimum opening deposit or require a small amount to open the account. These accounts also tend to not have monthly service fees. Low or no minimum opening requirements and no fees are why you should always try and earn many times more than the average rate. But each bank is different, so compare banks to confirm the opening deposit amounts and that the account doesn’t have a monthly fee – or that it has an easy way to waive the fee if it does have one."
https://finance.yahoo.com/news/why-ultra-high-yield-dividend-201931509.html,Why Ultra-High-Yield Dividend Stock Medical Properties Trust Is Skyrocketing This Week,"Thu, April 18, 2024, 3:19 PM CDT",MPW+4.61%WatchlistWatchlistWatchlistSign in to add to watchlistSign inRecommendation RatingHold,"Shares of Medical Properties Trust (NYSE: MPW) were skyrocketing 25.1% this week as of the market close on Thursday, according to data provided by S&P Global Market Intelligence. The big jump was due to two positive announcements from the company last week.On Friday, April 12, Medical Properties Trust reported the sale of its interests in five Utah hospitals to a joint venture (JV) with an investment fund for around $1.1 billion. Medical Properties Trust owns roughly 25% of the JV. The same day, the healthcare real estate investment trust (REIT) declared its quarterly dividend of $0.15 per share -- unchanged from the previous quarter.Why investors liked Medical Properties Trust's news so muchMuch of Medical Properties Trust's value proposition to investors stems from its ultra-high-yield dividend. Some investors were likely worried that the REIT would cut its dividend payout for the second time in nine months. That didn't happen, allowing shareholders to breathe a big sigh of relief.Even better, the sale of the Utah hospitals further fortifies Medical Properties Trust's balance sheet. This deal came on top of another sale announced on April 9 of five facilities in California and New Jersey to Prime Healthcare for a total of $350 million. These transactions improve the likelihood that Medical Properties Trust can continue to pay its dividend at current levels.Is Medical Properties Trust stock a buy now?Medical Properties Trust's latest updates arguably give investors a reason to be cautiously optimistic about the company. The stock could continue to be highly volatile, though. Medical Properties Trust isn't out of the woods just yet. Most investors will be better off avoiding the stock for now. However, the healthcare REIT's dividend yield of nearly 12.2% combined with the potential for a sustained rebound could be tempting to aggressive investors.Should you invest $1,000 in Medical Properties Trust right now?Before you buy stock in Medical Properties Trust, consider this:Story continuesThe Motley Fool Stock Advisor analyst team just identified what they believe are the 10 best stocks for investors to buy now… and Medical Properties Trust wasn’t one of them. The 10 stocks that made the cut could produce monster returns in the coming years.Consider when Nvidia made this list on April 15, 2005... if you invested $1,000 at the time of our recommendation, you’d have $514,887!*Stock Advisor provides investors with an easy-to-follow blueprint for success, including guidance on building a portfolio, regular updates from analysts, and two new stock picks each month. The Stock Advisor service has more than quadrupled the return of S&P 500 since 2002*.See the 10 stocks »*Stock Advisor returns as of April 15, 2024Keith Speights has positions in Medical Properties Trust. The Motley Fool has no position in any of the stocks mentioned. The Motley Fool has a disclosure policy.Why Ultra-High-Yield Dividend Stock Medical Properties Trust Is Skyrocketing This Week was originally published by The Motley Fool"
