Title_URL,Title,Date,Ticker,Content
https://finance.yahoo.com/news/stocks-vs-etfs-invest-213953905.html,Stocks vs. ETFs: Which should you invest in?,"Thu, April 18, 2024, 4:58 PM CDT",,"If you’re getting started investing, you might wonder whether it’s better to invest in stocks or ETFs. Well, the answer depends. Stocks can be a great investment in some circumstances, while ETFs can be better in others. But for new investors, exchange-traded funds solve many problems, and they’re an easy way to earn attractive returns — so they’re a great starting point.Here’s all you need to know about stocks vs. ETFs and when it’s best to use each one.Stocks and ETFs: How they differStocks and ETFs are similar in some ways, not surprisingly, since ETFs often contain many stocks. Despite their likenesses, they’re fundamentally different and present various upsides and risks.StocksA stock represents a fractional ownership interest in a business and typically trades on an exchange, in the case of a publicly traded company. When you own a stock, you’re investing in the success of that company — and only that company.In the short term, stocks may rise and fall for many reasons, and market sentiment often determines how a stock performs day to day. In the long term, however, a stock more closely follows the company’s growth. As the company expands its profits, the stock will tend to rise as well.Individual stocks can perform phenomenally over time, but they may be volatile in the short term, fluctuating massively. It’s not unusual for high-flying stocks to decline 50 percent in a given year on their way to long-term outperformance. On the other hand, a strong stock might go up 50 percent or more in a single year, especially if the overall market is hot.ETFsETFs are collections of assets, often stocks, bonds or a mix of the two. A single ETF might own dozens, sometimes hundreds, of stocks. So by owning a single share of the ETF, investors can own an indirect stake in all the stocks (or other assets) held by the fund. It’s a great (and often inexpensive) way to buy a collection of stocks.ETFs often invest in stocks that have a specific focus area, for example, large companies, value-priced stocks, dividend-paying companies or those operating in a specific industry, such as financial companies. Some specialized ETFs allow you to potentially earn higher returns.Story continuesMost ETFs are passively managed, meaning that they replicate a specific index of assets, such as the S&P 500, a collection of hundreds of America’s largest companies. The ETF changes its holdings only when the underlying index changes its constituents.Because of their wide array of holdings, ETFs provide the benefits of diversification, including lower risk and less volatility, which often makes a fund safer to own than an individual stock.An ETF’s return depends on what it’s invested in. An ETF’s return is the weighted average of all its holdings. So if it owns many strong stocks, the ETF will rise. If it owns many poorly performing stocks, then the ETF will decline, too.The table below shows some of the key differences between stocks and ETFs.CharacteristicStocksETFsPotential upsideHighLow-high, depending on the investmentRiskHighLow-high, depending on the investmentLifetimePotentially infinitePotentially infiniteBrokerage commissionsNo commission at major online brokersNo commission at major online brokersWhen you can trade themAny time the market is openAny time the market is openTaxCan be taxed at short-term or long-term capital gains rates, depending on holding periodCan be taxed at short-term or long-term capital gains rates, depending on holding periodThe pros and cons of stocksInvesting in a stock can offer a lot of benefits, though it’s not without some serious drawbacks.Advantages of investing in stocksInvesting in an individual stock can deliver very high returns, and you won’t be taxed on any capital gains until you sell, in a taxable account.A single stock can potentially return a lot more than an ETF, where you receive the weighted average performance of the holdings.Stocks can pay dividends, and over time those dividends can rise, as the top companies increase their payouts.Companies can be acquired at a substantial premium to the current stock price.Commissions on stock trading have been slashed to zero at major online brokers, meaning it doesn’t cost anything to get in and out of an investment.Investors who hold a stock for more than a year may enjoy lower capital gains tax rates.You can still own the wealth-building power of stocks within an ETF or mutual fund.Disadvantages of investing in stocksStocks can fluctuate a lot from day to day and month to month, meaning you may need to sell at a loss and may never recover what you invested.Volatility can be dangerous for investors who have all their wealth tied up in just one or a few stocks. If that one stock does poorly, the investor has a lot of eggs in one basket and can lose a significant portion of wealth.Stocks aren’t an investment guaranteed by the government, so you may lose all your money.Because an individual stock tracks the performance of the company over time, you have to own a winning company to make money. Pick a loser and you’ll lose money.Much effort is required to analyze and value individual stocks, and many people simply don’t have the time or desire to do so.You’ll need to pay taxes on any capital gains you generate, though you also have the ability to write off losses and get a tax break.The pros and cons of ETFsETFs offer plenty of benefits to investors, whether they’re new to the game or are more advanced, though these funds don’t come without some drawbacks.Advantages of investing in ETFsETFs allow you to buy one fund and have a stake in dozens or even thousands of companies.Because of this broad ownership, ETFs offer the power of diversification, reducing your risk and increasing your returns.A well-diversified ETF such as one based on the S&P 500 can beat most investors over time, making it easy for regular investors to do well in the market.ETFs tend to be less volatile than individual stocks, meaning your investment won’t swing in value as much.The best ETFs have low expense ratios, the fund’s cost as a percentage of your investment. The best may charge only a few dollars annually for every $10,000 invested.ETFs can be bought and sold any time the market is open, giving you a highly liquid asset.ETFs can be traded at no cost at most major online brokers.It takes little investing expertise to invest in ETFs and earn high returns.You won’t be taxed on any capital gains until you sell the ETF in a taxable account.Like stocks, ETFs can pay dividends.Disadvantages of investing in ETFsETFs, even in a good year, will underperform the best stocks in the fund, meaning investors could have owned just those stocks and done better.ETFs do charge an incremental cost, the expense ratio, for owning the fund.Not all ETFs are the same, so investors do have to understand what they own and what it could return.Like stocks, the investment performance of ETFs isn’t guaranteed by the government and you could lose money on the investment.You can’t control what’s invested in any single fund, though of course you don’t have to buy shares in that fund either.ETF vs. stock: Which is better for your portfolio?Buying individual stocks or ETFs can work better for individual investors in a variety of scenarios, and here’s when each one shines:When stocks are betterYou enjoy analyzing and following individual companies. It takes a lot of work to follow a stock, understand the industry, analyze financial statements and keep up with earnings. Many people don’t want to spend this time.You want to find outperformers. If you can find the stocks that will outperform — for example, Amazon or Microsoft — you can beat the market and most ETFs.You’re an advanced investor with time to devote to investing. Many investors enjoy following companies and tracking them over time. If that’s you, then buying individual stocks may be a great option for you.When ETFs are betterYou don’t want to spend much time investing. If you’re looking for an easy solution to investing, ETFs can be an excellent choice. ETFs typically offer a diversified allocation to whatever you’re investing in (stocks, bonds or both).You want to beat most investors, even the pros, with little effort. Buy an ETF based on the S&P 500 and you’ll wind up beating the vast majority of investors over time. That’s right, passive investing with ETFs generally beats active investing.You don’t want to analyze individual companies. If you have no desire to follow business, then pick an ETF or a few, and add to them over time.You’re a new or intermediate investor. ETFs are great for investors who are getting started, helping reduce your risk as your knowledge gets up to speed. But even many advanced investors use them, too.You want to invest in a specific trend without picking winners. Is there a hot new industry but you’re unable to pick which company will come out on top? Buy an ETF and get exposure to the whole sector at low cost.Of course, it’s possible for investors to do both of these strategies. For example, you could have 90 percent of your portfolio in ETFs and the remainder in a few stocks that you enjoy following. You can hone your skills at investing in individual stocks without hurting your returns much. Then, when you’re ready you can shift to more individual stocks and away from ETFs.Bottom lineETFs make a great pick for many investors who are starting out as well as for those who simply don’t want to do all the legwork required to own individual stocks. Though it’s possible to find the big winners among individual stocks, you have strong odds of doing well consistently with ETFs. Of course, you can blend the two methods as well, getting the benefits of a diversified portfolio with the potential extra juice from a few individual stocks on the side, if you want to try your skill.Note: Bankrate’s Rachel Christian also contributed to this story.Editorial Disclaimer: All investors are advised to conduct their own independent research into investment strategies before making an investment decision. In addition, investors are advised that past investment product performance is no guarantee of future price appreciation."
https://finance.yahoo.com/news/state-freight-long-trucking-market-215841265.html,State of Freight: How long will trucking market trough linger?,"Thu, April 18, 2024, 4:58 PM CDT",,"The bottom of the weak freight market may be here, according to Craig Fuller speaking at the April State of Freight webinar. (Photo: FreightWaves)With the equities market for trucking stocks reeling this week on the backs of two companies’ highly bearish disclosures, one question loomed large on the FreightWaves State of Freight webinar: Are we getting near the bottom?Battered and bruised in #trucking this a.m. due to numbers from $JBHT and $KNX. At approximately 10:50, here were some of the % drops: $XPO, -4.6%; $WERN, -2.5%; $TFII, -7%; $SNDR, -4.3%; $SAIA, -3.4%; $ODFL, -5.5%; Hunt, -9.2%; Knight Swift, -4%; $FWRD, -9.08%; $ARCB, -8%. pic.twitter.com/NeCAhaDZVG— John Kingston (@JohnHKingston) April 17, 2024FreightWaves CEO Craig Fuller and the head of market research for FreightWaves’ SONAR data dashboard, Zach Strickland, were mostly optimistic that the answer might be yes. Here are five takeaways.J.B. Hunt’s earnings may be the sign that things are at a bottomFuller called a recent negative earnings report by J.B. Hunt (NASDAQ: JBHT) and a lowering of forecast earnings by Knight-Swift (NYSE: KNX) a “capitulation” that could signal a market bottom.Story continuesReferring to an article he wrote for FreightWaves earlier this week, Fuller said the article did not herald a recovery in freight markets. Rather, “it’s a market bottom.”“I just think the market is capitulating,” Fuller said. “There’s an interesting thing in financial markets where you almost need everyone to sort of agree to give in for there to be a market recovery. To me, this is a moment of capitulation.”Fuller said previously in the down cycle, larger carriers had signaled in earnings calls, presentations and simple market anecdotes that the bigger companies were “unwilling to sort of make significant concessions in terms of rates.”But now, “we’re seeing the larger carriers capitulate.” And that leads to bullishness on his part because it brings about more of a normalization between spot and contract prices. “I think as we see contract rates refresh as new rates come in, I am bullish for that, as that is the capitulation,” Fuller added.On the J.B. Hunt earnings call, Darren Field, the president of intermodal at the company, said the market has been “a dogfight, with truckload capacity pricing being really, really competitive.”Capitulation, Fuller said, involves “the moments where the larger carriers have realized that they’re going to have to do things that they did not want to do.”The demand side of the equationVolumes are “relatively strong,” Fuller said. He and Strickland, who moderates the webinar, pointed to the Contract Load Accepted Volume index in SONAR. It is up 9% in the past year.Strickland said CLAV is especially useful at showing freight volumes because the data is stripped of tender rejections. “So it’s a pretty good measure of the absolute volume carried by some of the larger fleets,” he said.The fact that it’s up 9% in a year “tells me that volume is pretty robust,” Fuller said. The problem continues to be “just too much capacity.”Fuller added that projections of U.S. GDP growth — noting 3% growth in the first quarter — generally signal higher freight volumes down the road. “It’s conceivable that if we get a 2% to 3% GDP growth that we could be back to sort of where we were a year ago,” Fuller said. But he added, “I’m not suggesting there’s going to be a massive surge.”Strickland added, “One of the things that I have trouble kind of conveying to people right now is that it’s not a demand issue.”An anniversary nobody wants to acknowledgeFuller said he dates the start of the Great Freight Recession to the end of March 2022. The first recession that accompanied the start of the COVID pandemic brought the Outbound Tender Volume Index in SONAR down to less than 9,000, and as Fuller said, there was a belief that it might drop to 7,000. The OTVI currently stands near 11,325.The upside of the V-shaped recovery that quickly followed the beginning of the pandemic brought the OTVI back up to pre-pandemic levels by June 2020. That strong cycle lasted until about March 2022 before it entered the down period that is now in the midst of its second anniversary.It shows up in many places, but Fuller said it most clearly is in the Outbound Tender Reject Index, which measures contract freight that carriers choose not to lift. It dropped from about 15% two years ago to its long-languishing stay in the 3% to 5% range, where it has been pretty much for those 24 months.A Trump election could impact buying patterns“The threat of Donald Trump winning the election is going to force retailers and importers to think differently about what they do in the supply chain,” Fuller said when asked about how November’s presidential election might impact freight markets. Trump’s promise for even more robust tariffs than in his first administration will need to be on the mind of importers should a Trump return to office become evident as Election Day draws closer. “I think he’s going to move relatively quickly to start putting these tariffs in place because he’ll feel like he wants to send a really strong message,” Fuller said.Given that, it’s likely that companies may begin to build inventories ahead of new tariffs. Fuller also noted that given some recent steps by the Biden administration, and its failure to take the Trump-era tariffs off, “they’re both protectionist.”“The bottom line is, I do think we will see increased imports as we did back in 2017,” Fuller said, referring to the period before the first tariffs were implemented by the Trump administration.Measuring private fleetsFuller said OTRI and OTVI do not measure private fleet activity because there is no such thing as tendered freight to be rejected. The private fleet handles whatever comes its way. “We do know that the private fleets expanded aggressively during COVID and have continued to do that,” he added.The continued growth in sales of Class 8 tractors even in the midst of a freight recession is likely the result of increased private fleet activity, according to Fuller. “We’re not sure exactly how much but it definitely affected us for sure,” he said.More articles by John KingstonScopelitis seminar delves into lease purchase deals, M&A, ESG and more5 auto haulers combining to create publicly traded trucking companyCTA, OOIDA to appeal court decision upholding AB5 in California truckingThe post State of Freight: How long will trucking market trough linger? appeared first on FreightWaves."
https://finance.yahoo.com/news/stock-market-today-us-indexes-215433893.html,Stock market today: US indexes gain as traders try to break 4-day losing streak,"Thu, April 18, 2024, 4:54 PM CDT",,"Angela Weiss/Getty ImagesUS stocks were mixed Thursday as trader struggled to recover from a streak of losses.Jobless claims held steady at 212,000, matching the revised level from the previous week.Traders will hear remarks from Fed Presidents John Williams and Raphael Bostic later on Thursday.US stocks were mixed on Thursday as traders tried to snap back from a four-day losing streak.As earnings season kicks into gear, Wall Street has its sights set on heavyweight companies' Q1 reports in the coming days. Chip giants like Nvidia, Broadcom, and Micron Technology are seeing some upward momentum after the group sold off in recent sessions.Indexes wavered after jobless claims data. Initial jobless claims held steady at 212,000, matching the revised level from the previous week, according to the Labor Department. Economists had anticipated an increase to 215,000 from the initially reported 211,000 for the prior week.Treasury yields moved higher, with the 10-year yield edging up by three basis points to 4.624%.Traders are awaiting on fresh remarks from New York Fed President John Williams and Atlanta Fed President Raphael Bostic later today. Expectations for rate cuts in 2024 have dropped from six at the year's start to just two, with some analysts even warning of a potential hike in the cards if inflation remains stubbornly high.""Recent data have clearly not given us greater confidence"" that inflation is coming fully under control and ""instead indicate that it's likely to take longer than expected to achieve that confidence,"" Powell said during a panel discussion on Tuesday.""I still am expecting inflation to come down, but I do think that we need to be watching and gathering more information before we take action,"" Cleveland Fed President Loretta Mester said on Wednesday.Here's where US indexes stood shortly after the 9:30 a.m. opening bell on Thursday: S&P 500:  5,019.17, down 0.06%Dow Jones Industrial Average: 37,887.39, up 0.36% (+134.08 points)Story continuesNasdaq Composite: 15,638.65, down 0.25%Here's what else is going on:The stock market is headed for a hard 'reset' that could take years to recover from, CIO says.Nvidia stock could soar 81% if investors recognize its full potential as an AI ecosystem, rather than just a chipmaker, Evercore saysThe US freight recession keeps getting deeper.Bitcoin's latest sell-off is a good entry point for investors ahead of halving, JPMorgan says.In commodities, bonds, and crypto: West Texas Intermediate crude oil rose by 0.6% to $83.10 a barrel. Brent crude, the international benchmark, edged higher to $87.52 a barrel.Gold rose 1.25% to $2,390.25 per ounce.The 10-year Treasury yield rose three basis point to 4.624%.Bitcoin rose 1.81% to $62,391.Read the original article on Business Insider"
https://finance.yahoo.com/news/huge-bond-wagers-hedge-funds-175729830.html,"Some Hedge Funds Too Big to Fail for Bond Market, IMF Says","Thu, April 18, 2024, 4:23 PM CDT",,"(Bloomberg) -- A small group of funds has accumulated such large short wagers in the Treasury market that they could destabilize the broader financial system during times of stress, according to the International Monetary Fund.Most Read from BloombergElon Wants His Money BackDubai Grinds to Standstill as Flooding Hits CityRecord Rainfall in Dubai? Blame Climate Change, Not Cloud SeedingSingapore Loses ‘World’s Best Airport’ Crown to QatarRed Lobster Considers Bankruptcy to Deal With Leases and Labor Costs“A concentration of vulnerability has built up, as a handful of highly leveraged funds account for most of the short positions in Treasury futures,” the IMF said in its Global Financial Stability Report released this week. “Some of these funds may have become systemically important to the Treasury and repo markets, and stresses they face could affect the broader financial system.”The IMF’s comments came in a section discussing the so-called basis trade, which contributed to turmoil in the world’s biggest bond market at the time of the pandemic outbreak in 2020.In this trade, hedge funds exploit tiny differences between the prices of cash Treasuries and futures, using large sums of money borrowed from the repurchase-agreement market to amplify returns. Because of this leverage and reliance on short-term funding, the bet has drawn increasing scrutiny from regulators. And now the IMF is highlighting another risk: concentrated positions.Read more: The Kings of a Colossal Bond Trade That’s Spooking RegulatorsAs of December, about half the two-year Treasury short positions in the futures market were in the hands of eight traders or less, according to the IMF. It was at a similar level at the end of 2019, just before a surge in funding costs in the early days of the pandemic spurred traders to unwind the positions, which helped boost volatility in bonds at a time of upheaval across financial markets.The IMF didn’t cite specific funds, but Bloomberg reported in December that firms including ExodusPoint Capital Management, Millennium Management and Citadel have used the wager.Story continuesThe IMF acknowledged that basis trades are helpful in providing market liquidity under “normal” conditions. But it also expressed concern that the trade’s rapid growth lifted the leverage in the financial system.The popularity of basis trades swelled along with the Federal Reserve’s interest-rate hikes, which potentially make the strategy more profitable by widening the price gap between the cash and futures markets.Read more: What’s the Basis Trade? Why Does It Worry Regulators?: QuickTakeA Fed study last month estimated that hedge funds have amassed at least $317 billion in Treasury holdings related to basis trades since the first quarter of 2022, although the size is “significantly” less than it previously estimated.The Securities and Exchange Commission has been working to rein in basis trades and increase the transparency of hedge funds’ exposure to the strategy. In December, the SEC required the funds and brokerages to centrally clear far more of their US Treasuries transactions, a move to bolster oversight of basis trades.Since then, there are signs that use of the trade may be waning: Commodity Futures Trading Commission data shows a decline in leveraged funds’ short positions in bond futures.The concentration in these bets has also diminished. In two-year futures, net short positions controlled by eight traders or less have dropped to about 38% of total open interest, from 50% in early January, according to CFTC data compiled by Bloomberg.Despite that unwinding, the IMF noted the short positions of leveraged funds remain large, which means they may still loom as a risk.As the Fed shrinks its holdings of Treasuries, a process known as quantitative tightening, it also may reduce the liquidity in the financial system, potentially triggering a jump in funding costs and leading the basis trade to unravel, the IMF said.“Basis trade investors rely on low repo haircuts and low repo rates to leverage their positions and increase basis trade profitability,” the report said. “A spike in repo rates — triggered, for example, by surprises in quantitative tightening — can render the trade unprofitable and could trigger the forced selling of Treasury securities and a brisk unwinding of futures positions as funds seek to quickly delever.”--With assistance from Liz Capo McCormick and Edward Bolingbroke.(Adds IMF comment in seventh paragraph.)Most Read from Bloomberg BusinessweekWhat Really Happens When You Trade In an iPhone at the Apple StoreRents Are the Fed’s ‘Biggest Stumbling Block’ in Taming US InflationAging Copper Mines Are Turning Into Money Pits Despite DemandThe Pentagon Wants to Give Defense Startups a Chance For Multinationals, Africa’s Allure Is Fading©2024 Bloomberg L.P."
